user_id,post_id,post,post_tags,release_date
1,1,"Halo, pecinta buku anak!

Gramedia sedang mengadakan promo diskon 50% untuk buku-buku anak terbaru. Promo ini berlaku di seluruh toko buku Gramedia di Indonesia, mulai dari tanggal 15 Juli hingga 31 Juli 2023.

Ada banyak buku anak terbaru yang bisa Anda dapatkan dengan harga hemat, seperti:

1. ""Cerita Si Kancil yang Cerdik"" oleh A.T. Mahyadi
2. ""Petualangan Si Unyil di Dunia Fantasi"" oleh Gunawan Wicaksono
3. ""Kisah-Kisah Nabi dan Rasul"" oleh Tim Cerita Islam

Segera kunjungi toko buku Gramedia terdekat dan dapatkan buku-buku anak favorit Anda dengan harga yang lebih murah!","diskon,anak",2023-10-01
4,2,"Halo, pecinta Tere Liye!

Penulis Tere Liye akan mengadakan acara Meet and Greet di Gramedia Matraman pada hari Sabtu, 22 Juli 2023, pukul 13.00 WIB.

Dalam acara ini, Tere Liye akan bercerita tentang proses kreatifnya dalam menulis buku, serta menjawab pertanyaan dari para penggemarnya.

Acara ini terbuka untuk umum dan gratis. Peserta hanya perlu mendaftarkan diri di toko buku Gramedia Matraman.

Segera daftarkan diri Anda dan dapatkan kesempatan untuk bertemu langsung dengan Tere Liye!","acara,penulis",2023-10-02
27,3,"Buku ""Cerita Si Kancil yang Cerdik"" karya A.T. Mahyadi adalah sebuah buku cerita anak yang menceritakan tentang kelicikan Si Kancil dalam menghadapi berbagai masalah.

Buku ini ditulis dengan bahasa yang sederhana dan mudah dipahami oleh anak-anak. Selain itu, buku ini juga dilengkapi dengan ilustrasi yang menarik dan berwarna-warni.

Buku ""Cerita Si Kancil yang Cerdik"" sangat cocok untuk dibaca oleh anak-anak usia 3-6 tahun. Buku ini dapat mengajarkan anak-anak untuk berpikir kreatif dan cerdik dalam menghadapi masalah.","ulasan,anak",2023-10-03
9,4,"Berikut adalah beberapa rekomendasi buku fiksi untuk remaja:

1.""A Thousand Splendid Suns"" oleh Khaled Hosseini
2.""The Fault in Our Stars"" oleh John Green
3.""To Kill a Mockingbird"" oleh Harper Lee
4.""The Hunger Games"" oleh Suzanne Collins
5.""The Perks of Being a Wallflower"" oleh Stephen Chbosky

Buku-buku ini bercerita tentang berbagai tema yang relevan dengan kehidupan remaja, seperti cinta, persahabatan, keluarga, dan pencarian jati diri.

Buku-buku ini juga ditulis dengan gaya bahasa yang menarik dan mudah dipahami oleh remaja.","rekomendasi,remaja",2023-10-04
3,5,"Membaca buku dapat memberikan berbagai manfaat bagi kesehatan mental, seperti:

1.Mengurangi stres
2.Meningkatkan mood
3.Meningkatkan empati
4.Meningkatkan kreativitas
5.Meningkatkan kemampuan berpikir kritis

Berikut adalah beberapa tips membaca buku untuk kesehatan mental:

1.Pilihlah buku yang Anda sukai
2.Membacalah di tempat yang tenang dan nyaman
3.Luangkan waktu untuk membaca setiap hari
4.Diskusikan buku yang Anda baca dengan orang lain

Dengan mengikuti tips-tips di atas, Anda dapat meningkatkan kesehatan mental Anda dengan membaca buku.","tips,kesehatan",2023-10-05
5,6,"Halo, pecinta Tere Liye!

Penulis Tere Liye akan mengadakan acara peluncuran buku terbarunya di Jakarta pada hari Sabtu, 29 Juli 2023, pukul 19.00 WIB.

Acara ini akan diadakan di Balai Sarbini, Jakarta Selatan.

Dalam acara ini, Tere Liye akan bercerita tentang buku terbarunya, serta menandatangani buku-bukunya untuk para penggemarnya.

Acara ini terbuka untuk umum dengan harga tiket Rp100.000. Tiket dapat dibeli secara online atau di loket Balai Sarbini.

Segera beli tiket Anda dan dapatkan kesempatan untuk bertemu langsung dengan Tere Liye!","acara,penulis",2023-10-06
17,7,"Berikut adalah beberapa rekomendasi buku non-fiksi untuk dewasa:

1.""Sapiens: A Brief History of Humankind"" oleh Yuval Noah Harari
2.""Homo Deus: A Brief History of Tomorrow"" oleh Yuval Noah Harari
3.""The 7 Habits of Highly Effective People"" oleh Stephen R. Covey
4.""The Power of Habit"" oleh Charles Duhigg
5.""The Alchemist"" oleh Paulo Coelho

Buku-buku ini membahas berbagai tema yang bermanfaat bagi kehidupan dewasa, seperti sejarah, filsafat, pengembangan diri, dan motivasi.

Buku-buku ini juga ditulis dengan gaya bahasa yang menarik dan mudah dipahami oleh orang dewasa.","rekomendasi,dewasa,non-fiksi",2023-10-07
24,8,"Memilih buku anak yang tepat sangat penting untuk mendukung perkembangan anak. Berikut adalah beberapa tips memilih buku anak yang tepat:

1.Pertimbangkan usia dan minat anak Anda. Pilihlah buku yang sesuai dengan usia dan minat anak Anda.
2.Pilihlah buku yang berkualitas. Pastikan buku yang Anda pilih memiliki kualitas yang baik, baik dari segi konten maupun ilustrasi.
3.Pilihlah buku yang menarik. Buku yang menarik akan membuat anak Anda lebih tertarik untuk membacanya.

Dengan mengikuti tips-tips di atas, Anda dapat memilih buku anak yang tepat untuk mendukung perkembangan anak Anda.","tips,anak",2023-10-08
97,9,"Halo, pecinta buku fiksi!

Yuk, gabung komunitas pecinta buku fiksi di aplikasi baca buku ini!

Di komunitas ini, kita bisa saling berdiskusi tentang buku-buku fiksi yang kita sukai. Kita juga bisa saling berbagi rekomendasi buku-buku fiksi yang bagus.

Jadi, tunggu apa lagi? Yuk, gabung komunitas pecinta buku fiksi sekarang juga!","komunitas,obrolan,fiksi",2023-10-09
35,10,"Membaca buku dapat membantu meningkatkan produktivitas. Berikut adalah beberapa tips membaca buku untuk meningkatkan produktivitas:

1.Pilihlah buku yang sesuai dengan tujuan Anda. Jika Anda ingin meningkatkan produktivitas, pilihlah buku yang membahas tentang manajemen waktu, produktivitas, atau motivasi.
2.Luangkan waktu untuk membaca secara rutin. Jadwalkan waktu khusus untuk membaca buku setiap hari.
3.Buatlah catatan saat membaca. Catatlah hal-hal penting yang Anda pelajari dari buku yang Anda baca.

Dengan mengikuti tips-tips di atas, Anda dapat meningkatkan produktivitas Anda dengan membaca buku.",tips,2023-10-10
74,11,"Yuk, simak ulasan buku terbaru ""Petualangan Si Unyil di Dunia Fantasi"" oleh Gunawan Wicaksono.

Buku ini mengisahkan petualangan seru Si Unyil yang membawanya ke dunia fantasi yang penuh keajaiban.

Dilengkapi dengan ilustrasi yang menarik, buku ini cocok untuk anak-anak yang suka petualangan dan imajinasi tinggi.

Segera dapatkan buku ini di toko buku Gramedia terdekat!","ulasan,anak",2023-10-11
32,12,"Selamat pagi, pecinta buku!

Ada diskon spesial untuk pembelian buku di atas Rp200.000. Dapatkan potongan harga sebesar Rp50.000!

Promo ini berlaku di semua toko buku Gramedia di Indonesia mulai dari tanggal 5 Agustus hingga 15 Agustus 2023.

Jangan lewatkan kesempatan untuk mendapatkan buku-buku favorit Anda dengan harga lebih terjangkau. Segera kunjungi toko buku Gramedia sekarang!","diskon,umum",2023-10-12
14,13,"Yuk, ikuti acara talkshow bersama penulis Gunawan Wicaksono di Gramedia Plaza Senayan pada hari Minggu, 30 Juli 2023, pukul 15.00 WIB.

Dalam acara ini, Gunawan Wicaksono akan berbicara tentang karyanya yang terbaru, ""Petualangan Si Unyil di Dunia Fantasi,"" serta berbagi pengalaman menarik selama proses menulisnya.

Acara ini terbuka untuk umum dan peserta akan mendapatkan kesempatan untuk bertemu langsung dengan penulisnya.

Segera daftarkan diri Anda dan nikmati acara seru bersama Gunawan Wicaksono!","acara,penulis",2023-10-13
19,14,"Buku ""Kisah-Kisah Nabi dan Rasul"" adalah buku yang cocok untuk anak-anak yang ingin belajar tentang kisah-kisah para nabi dan rasul dalam agama Islam.

Dengan bahasa yang ringan dan ilustrasi yang menarik, buku ini akan membantu anak-anak memahami kisah-kisah tersebut dengan lebih mudah.

Dapatkan buku ini di toko buku Gramedia terdekat dan berikan pengetahuan agama yang bermanfaat untuk anak Anda.","ulasan,anak",2023-10-14
63,15,"Yuk, ikuti acara workshop menulis cerita anak bersama penulis A.T. Mahyadi di Gramedia Puri Indah pada hari Sabtu, 5 Agustus 2023, pukul 14.00 WIB. Dalam acara ini, A.T. Mahyadi akan berbagi tips dan trik menulis cerita anak yang menarik dan mendidik. Peserta akan diajak untuk berlatih menulis cerita anak bersama-sama. Acara ini terbuka untuk semua kalangan, baik yang sudah memiliki pengalaman menulis maupun yang masih pemula.","acara,penulis,tips",2023-10-15
39,16,"Rekomendasi buku-buku yang pernah aku baca:

1.""The Silent Patient"" oleh Alex Michaelides
2.""Where the Crawdads Sing"" oleh Delia Owens
3.""Educated"" oleh Tara Westover
4.""Becoming"" oleh Michelle Obama
5.""The Night Circus"" oleh Erin Morgenstern","rekomendasi,umum",2023-10-16
26,17,"Mau dapat diskon tambahan untuk pembelian buku? Ikuti saja langkah berikut:

1.Beli buku-buku favorit Anda di toko buku Gramedia.
2.Pastikan total pembelian Anda mencapai minimal Rp300.000.
3.Tunjukkan kartu anggota Gramedia Club Anda saat pembayaran.

Dengan begitu, Anda akan mendapatkan diskon tambahan sebesar 10%! Jangan lewatkan promo menarik ini dan segera kunjungi toko buku Gramedia.","diskon,umum",2023-10-17
7,18,"Selamat berakhir pekan, pecinta fanfiction!",umum,2023-10-17
87,19,"Yuk, ikuti kelas literasi digital untuk anak-anak di Gramedia Kids Club!

Kelas ini akan membantu anak-anak mengembangkan keterampilan literasi digital mereka dengan cara yang menyenangkan dan interaktif.

Dengan materi yang disesuaikan dengan usia anak, kelas ini cocok untuk anak-anak mulai dari 6 hingga 12 tahun.

Segera daftarkan anak Anda dan berikan pengalaman literasi digital yang bermanfaat untuk masa depan mereka!""
","komunitas,tips,anak",2023-10-18
55,20,Disini ada yang pernah baca fanfic genre isekai? menurut kalian gimana ceritanya? makin kesini makin ngebosenin ga?,"umum, rekomendasi, fanfiction",2023-10-18
6,21,"Fiksi penggemar romansa Indonesia itu banyak sekali, tapi yang paling aku suka itu yang ceritanya tentang kisah cinta yang realistis dan bikin baper.","fiksi penggemar, romansa, indonesia",2023-10-20
45,22,"Aku sedang membaca buku thriller baru dari penerbit Gagasmedia, judulnya 'Suster'. 

Buku ini bercerita tentang seorang suster yang terjebak di rumah sakit angker. Buku ini seru banget, bikin penasaran terus.","buku, thriller, penerbit gagas media",2023-10-20
44,23,"Kalau kamu suka membaca novel sastra Indonesia, aku rekomendasikan novel 'Perempuan Tanah Jahanam' karya Eka Kurniawan. 

Novel ini bercerita tentang seorang perempuan yang tinggal di desa terpencil. Novel ini keren banget, bikin kita mikir.","rekomendasi buku, sastra, indonesia",2023-10-23
23,24,"Aku suka banget membaca fiksi penggemar superhero. 

Salah satu yang aku suka itu fiksi penggemar tentang superhero Marvel yang melawan penjahat super kuat.","fiksi penggemar, aksi, superhero",2023-10-24
12,25,"Aku sedang mencari buku cerita anak yang bagus untuk anak aku. 

Aku ingin buku cerita anak yang bisa mengajarkan anak aku tentang nilai-nilai moral. 

Ada rekomendasi buku cerita anak yang bagus?","buku, anak-anak, pendidikan",2023-10-24
11,26,"Aku tertarik membaca novel roman klasik. 

Aku ingin novel roman klasik yang ceritanya romantis dan menyentuh hati. 

Ada rekomendasi novel roman klasik yang bagus?","rekomendasi buku, roman, klasik",2023-10-25
76,27,"Aku suka banget membaca fiksi penggemar horor.

Salah satu yang aku suka itu fiksi penggemar tentang hantu pocong yang menghantui sebuah desa.","fiksi penggemar, horor, hantu",2023-10-27
99,28,"Aku tertarik membaca buku sejarah. 

Aku ingin buku sejarah yang bisa menjelaskan tentang sejarah Indonesia dengan jelas dan menarik. 

Ada rekomendasi buku sejarah yang bagus?","buku, nonfiksi, sejarah",2023-10-27
21,29,"Aku sedang mencari buku pengembangan diri yang bagus untuk membantu aku menjadi lebih baik. 

Aku ingin buku pengembangan diri yang bisa mengajarkan aku tentang cara berpikir positif dan mencapai tujuan.","rekomendasi buku, pengembangan diri, motivasi",2023-10-28
81,30,"Fiksi penggemar komedi Indonesia itu juga banyak sekali. 

Salah satu yang aku suka itu fiksi penggemar tentang orang-orang yang kocak dan bikin ngakak.","fiksi penggemar, komedi, indonesia",2023-10-30